{
  "$schema": "https://json-schema.org/draft/2020-12/schema",
  "$id": "https://raw.githubusercontent.com/jwaspin/luca-ledger/main/schema/src/schemas/entity.json",
  "title": "Entity",
  "description": "Defines the schema for entities within the application, categorizing them into specific, predefined types such as account, retailer, business, individual, utility, and government. This schema includes basic details and timestamps for creation and updates.",
  "type": "object",
  "additionalProperties": false,
  "properties": {
    "id": {
      "type": "string",
      "title": "ID",
      "description": "A unique identifier for the entity."
    },
    "name": {
      "type": "string",
      "title": "Name",
      "description": "The name of the entity."
    },
    "description": {
      "type": ["string", "null"],
      "title": "Description",
      "description": "A description of the entity. This can be null if no description is provided."
    },
    "entityType": {
      "type": "string",
      "title": "Type",
      "enum": [
        "ACCOUNT",
        "RETAILER",
        "SERVICE",
        "INDIVIDUAL",
        "UTILITY",
        "GOVERNMENT"
      ],
      "description": "The type of the entity, indicating its role or classification within the application. Controlled to specific predefined options for consistency and integrity."
    },
    "entityStatus": {
      "type": "string",
      "title": "Status",
      "enum": ["ACTIVE", "INACTIVE", "SUSPENDED", "DELETED", "CLOSED"],
      "description": "The status of the entity, indicating whether it is active, inactive, suspended, or deleted. Controlled to specific predefined options for consistency and integrity."
    },
    "createdAt": {
      "type": "string",
      "title": "Created At",
      "format": "date-time",
      "description": "The date and time when the entity was created, in ISO 8601 format."
    },
    "updatedAt": {
      "type": ["string", "null"],
      "title": "Updated At",
      "format": "date-time",
      "description": "The date and time when the entity was last updated, in ISO 8601 format. This can be null if the entity has not been updated since creation."
    }
  },
  "required": [
    "id",
    "name",
    "description",
    "entityType",
    "entityStatus",
    "createdAt",
    "updatedAt"
  ]
}
